[
  {
    "id": "VR-001",
    "name": "Corte Rubro",
    "faction": "Casa Vhal",
    "type": "Assalto",
    "rarity": "Comum",
    "cost": 1,
    "eclipse_shift": 1,
    "sigil": "Presa",
    "rules_text": "Cause 2 de dano. Se você sacrificou Vitalidade nesta rodada, cause +1.",
    "flavor": "A elegância termina onde a fome começa.",
    "design_role": "pressão"
  },
  {
    "id": "VR-002",
    "name": "Dívida de Sangue",
    "faction": "Casa Vhal",
    "type": "Rito",
    "rarity": "Comum",
    "cost": 1,
    "eclipse_shift": 1,
    "sigil": "Coroa",
    "rules_text": "Sacrifique 2 de Vitalidade: compre 2 cartas, depois descarte 1.",
    "flavor": "Todo favor da Casa vence com juros.",
    "design_role": "seleção de mão"
  },
  {
    "id": "VR-003",
    "name": "Manto Hemático",
    "faction": "Casa Vhal",
    "type": "Guarda",
    "rarity": "Comum",
    "cost": 1,
    "eclipse_shift": 1,
    "sigil": "Presa",
    "rules_text": "Previna 3 de dano. Se prevenir todo o dano, cure 1.",
    "flavor": "O sangue derramado também pode ser muralha.",
    "design_role": "defesa/dreno"
  },
  {
    "id": "VR-004",
    "name": "Taça de Orivane",
    "faction": "Casa Vhal",
    "type": "Relíquia",
    "rarity": "Rara",
    "cost": 2,
    "eclipse_shift": 1,
    "sigil": "Coroa",
    "rules_text": "A primeira vez por rodada que você curar, desloque o Eclipse 1 passo para a Noite.",
    "flavor": "A taça nunca esvazia; apenas muda de dono.",
    "design_role": "motor"
  },
  {
    "id": "VR-005",
    "name": "Fome Educada",
    "faction": "Casa Vhal",
    "type": "Assalto",
    "rarity": "Comum",
    "cost": 2,
    "eclipse_shift": 1,
    "sigil": "Presa",
    "rules_text": "Cause 3 de dano. Ressonância Presa→Coroa: cure 2.",
    "flavor": "Sorrisos polidos, intenções antigas.",
    "design_role": "combo"
  },
  {
    "id": "VR-006",
    "name": "Convite Irrecusável",
    "faction": "Casa Vhal",
    "type": "Rito",
    "rarity": "Incomum",
    "cost": 2,
    "eclipse_shift": 1,
    "sigil": "Espelho",
    "rules_text": "Olhe 2 cartas aleatórias da mão do oponente. Escolha uma: ela custa +1 até o fim da próxima rodada.",
    "flavor": "A porta estava aberta antes mesmo de você chegar.",
    "design_role": "disrupção"
  },
  {
    "id": "VR-007",
    "name": "Servo de Veludo",
    "faction": "Casa Vhal",
    "type": "Manifestação",
    "rarity": "Incomum",
    "cost": 2,
    "eclipse_shift": 1,
    "sigil": "Coroa",
    "rules_text": "Enquanto ativo, a primeira carta que exigir sacrifício de Vitalidade a cada rodada sacrifica 1 a menos.",
    "flavor": "Ele serve vinho, silêncio e álibis.",
    "design_role": "suporte"
  },
  {
    "id": "VR-008",
    "name": "Juramento da Cripta",
    "faction": "Casa Vhal",
    "type": "Rito",
    "rarity": "Rara",
    "cost": 3,
    "eclipse_shift": 1,
    "sigil": "Cinza",
    "rules_text": "Recupere um Assalto do descarte. Perca Vitalidade igual ao custo dele.",
    "flavor": "Algumas promessas sobrevivem aos prometidos.",
    "design_role": "recursão"
  },
  {
    "id": "VR-009",
    "name": "Veia Aberta",
    "faction": "Casa Vhal",
    "type": "Assalto",
    "rarity": "Incomum",
    "cost": 2,
    "eclipse_shift": 1,
    "sigil": "Presa",
    "rules_text": "Cause 2 de dano e aplique Sangramento 2.",
    "flavor": "O golpe é curto; a consequência, paciente.",
    "design_role": "dano contínuo"
  },
  {
    "id": "VR-010",
    "name": "Salão sem Espelhos",
    "faction": "Casa Vhal",
    "type": "Relíquia",
    "rarity": "Épica",
    "cost": 3,
    "eclipse_shift": 1,
    "sigil": "Espelho",
    "rules_text": "Ritos adversários que olhariam ou revelariam sua mão falham. Uma vez por rodada, quando isso ocorrer, desloque 1 para Noite.",
    "flavor": "Na Casa Vhal, reflexos são considerados testemunhas.",
    "design_role": "anti-controle"
  },
  {
    "id": "VR-011",
    "name": "Noite de Herança",
    "faction": "Casa Vhal",
    "type": "Rito",
    "rarity": "Épica",
    "cost": 4,
    "eclipse_shift": 2,
    "sigil": "Coroa",
    "rules_text": "Só pode ser jogada com Eclipse em +2 ou mais. Compre 3; até o fim da rodada, seus Assaltos custam 1 a menos.",
    "flavor": "Os antigos não deixam bens. Deixam apetites.",
    "design_role": "explosão"
  },
  {
    "id": "VR-012",
    "name": "Soberania Carmesim",
    "faction": "Casa Vhal",
    "type": "Assalto",
    "rarity": "Lendária",
    "cost": 5,
    "eclipse_shift": 2,
    "sigil": "Presa",
    "rules_text": "Cause 5 de dano. Eclipse Noturno: em vez disso, cause 7 e cure 3. Limite de 1 por deck.",
    "flavor": "O trono reconhece apenas quem sobrevive ao banquete.",
    "design_role": "finalizador"
  },
  {
    "id": "VR-013",
    "name": "Golpe da Alvorada",
    "faction": "Ordem Solara",
    "type": "Assalto",
    "rarity": "Comum",
    "cost": 1,
    "eclipse_shift": -1,
    "sigil": "Sol",
    "rules_text": "Cause 2 de dano. Se o Eclipse estiver em -1 ou menor, cause +1.",
    "flavor": "A manhã também sabe ferir.",
    "design_role": "pressão"
  },
  {
    "id": "VR-014",
    "name": "Égide de Lumen",
    "faction": "Ordem Solara",
    "type": "Guarda",
    "rarity": "Comum",
    "cost": 2,
    "eclipse_shift": -1,
    "sigil": "Sol",
    "rules_text": "Previna 4 de dano de um único Assalto.",
    "flavor": "A luz não precisa vencer; basta permanecer.",
    "design_role": "defesa"
  },
  {
    "id": "VR-015",
    "name": "Marca do Caçador",
    "faction": "Ordem Solara",
    "type": "Rito",
    "rarity": "Comum",
    "cost": 1,
    "eclipse_shift": 0,
    "sigil": "Coroa",
    "rules_text": "Aplique Exposto. O próximo dano que o alvo sofrer recebe +2, então remova Exposto.",
    "flavor": "Ninguém foge duas vezes do mesmo olhar.",
    "design_role": "setup"
  },
  {
    "id": "VR-016",
    "name": "Rosário de Ferro Branco",
    "faction": "Ordem Solara",
    "type": "Relíquia",
    "rarity": "Incomum",
    "cost": 2,
    "eclipse_shift": -1,
    "sigil": "Sol",
    "rules_text": "A primeira Maldição que receber em cada rodada dura 1 rodada a menos.",
    "flavor": "Fé, aqui, é engenharia.",
    "design_role": "anti-maldição"
  },
  {
    "id": "VR-017",
    "name": "Passo entre Sombras",
    "faction": "Ordem Solara",
    "type": "Guarda",
    "rarity": "Incomum",
    "cost": 2,
    "eclipse_shift": -1,
    "sigil": "Espelho",
    "rules_text": "Previna 2. Se o Assalto tinha bônus de Ressonância, previna +2.",
    "flavor": "Conhecer o truque é metade da defesa.",
    "design_role": "anti-combo"
  },
  {
    "id": "VR-018",
    "name": "Interrogatório ao Amanhecer",
    "faction": "Ordem Solara",
    "type": "Rito",
    "rarity": "Incomum",
    "cost": 2,
    "eclipse_shift": 0,
    "sigil": "Espelho",
    "rules_text": "Revele a mão do oponente. Escolha um Assalto; ele não pode ser jogado nesta rodada.",
    "flavor": "A verdade fica menos convincente sob a primeira luz.",
    "design_role": "controle"
  },
  {
    "id": "VR-019",
    "name": "Sentinela de Solenne",
    "faction": "Ordem Solara",
    "type": "Manifestação",
    "rarity": "Rara",
    "cost": 4,
    "eclipse_shift": -1,
    "sigil": "Sol",
    "rules_text": "Enquanto ativa, a primeira vez por rodada que você usar Guarda, ganhe Ward 1.",
    "flavor": "Ela nunca dorme antes do sino.",
    "design_role": "suporte"
  },
  {
    "id": "VR-020",
    "name": "Flecha de Vidro Solar",
    "faction": "Ordem Solara",
    "type": "Assalto",
    "rarity": "Rara",
    "cost": 3,
    "eclipse_shift": -1,
    "sigil": "Sol",
    "rules_text": "Cause 4 de dano. Ignora 2 pontos de Ward.",
    "flavor": "Feita para atravessar aquilo que jurou ser intocável.",
    "design_role": "anti-ward"
  },
  {
    "id": "VR-021",
    "name": "Círculo de Sal Dourado",
    "faction": "Ordem Solara",
    "type": "Rito",
    "rarity": "Rara",
    "cost": 2,
    "eclipse_shift": -1,
    "sigil": "Coroa",
    "rules_text": "Até sua próxima rodada, Manifestações adversárias perdem seus textos passivos.",
    "flavor": "Há monstros que respeitam fronteiras.",
    "design_role": "silêncio"
  },
  {
    "id": "VR-022",
    "name": "Segundo Horizonte",
    "faction": "Ordem Solara",
    "type": "Guarda",
    "rarity": "Épica",
    "cost": 4,
    "eclipse_shift": -1,
    "sigil": "Sol",
    "rules_text": "Previna 6 de dano de um Assalto. Depois, o oponente compra 1 carta.",
    "flavor": "Toda proteção cobra algo de alguém.",
    "design_role": "hard defense"
  },
  {
    "id": "VR-023",
    "name": "Mandato da Aurora",
    "faction": "Ordem Solara",
    "type": "Rito",
    "rarity": "Épica",
    "cost": 4,
    "eclipse_shift": -1,
    "sigil": "Coroa",
    "rules_text": "Mova o Eclipse 2 passos para a Aurora. Remova Sangramento e uma Maldição de você.",
    "flavor": "O dia não pede licença.",
    "design_role": "reset"
  },
  {
    "id": "VR-024",
    "name": "Sentença do Meio-Dia",
    "faction": "Ordem Solara",
    "type": "Assalto",
    "rarity": "Lendária",
    "cost": 5,
    "eclipse_shift": -2,
    "sigil": "Sol",
    "rules_text": "Cause 5. Aurora Total: cause 7 e o oponente não pode usar Guarda contra este Assalto. Limite 1 por deck.",
    "flavor": "Ao meio-dia, não há sombra onde esconder um juramento.",
    "design_role": "finalizador"
  },
  {
    "id": "VR-025",
    "name": "Refração Dolorosa",
    "faction": "Conclave Mirr",
    "type": "Assalto",
    "rarity": "Comum",
    "cost": 1,
    "eclipse_shift": 0,
    "sigil": "Espelho",
    "rules_text": "Cause 2. Se o último Sigilo desta rodada foi Sol ou Presa, cause +1.",
    "flavor": "Toda certeza possui um ângulo morto.",
    "design_role": "combo"
  },
  {
    "id": "VR-026",
    "name": "Carta que Não Existia",
    "faction": "Conclave Mirr",
    "type": "Rito",
    "rarity": "Comum",
    "cost": 1,
    "eclipse_shift": 0,
    "sigil": "Espelho",
    "rules_text": "Olhe as 2 do topo; coloque uma na mão e outra no fundo.",
    "flavor": "O papel lembra futuros que ninguém escreveu.",
    "design_role": "consistência"
  },
  {